{
  "$comment": "Production Configuration - EDIT serverUrl BEFORE DEPLOYMENT",
  "serverUrl": "https://forensicbridge.ca/api",
  "incrementalSyncFromDate": null,
  "version": "4.3",
  "schemaVersion": "4.3",
  "advanced": {
    "chunkSizeKB": 1024,
    "chunkedUploadThresholdMB": 10,
    "secureDeletePasses": 3,
    "initialBatchSize": 100,
    "enableAdaptiveBatching": true,
    "enablePreFlightCheck": true,
    "enableForensicHashing": true,
    "minimumServerVersion": "4.0",
    "enableVersionCheck": true,
    "maxFileStreamSizeMB": 2048,
    "enableLogRedaction": true,
    "logLevel": "INFO",
    "retryAttempts": 5,
    "retryDelayMs": 2000,
    "retryMaxDelayMs": 60000,
    "retryJitterPercent": 25,
    "enableExponentialBackoff": true,
    "allowInsecureHttpForLocalhost": false,
    "maxQBXMLVersion": null
  }
}